{
  "$schema": "https://json-schema.org/draft/2020-12/schema",
  "$id": "https://interactive-code-map/schemas/mapspec-v1.schema.json",
  "title": "MapSpec v1",
  "description": "Intermediate data model consumed by build-html.mjs and render.js. Authoritative definition; conflicts with prose resolved in favor of this schema.",
  "type": "object",
  "required": ["schemaVersion", "meta"],
  "additionalProperties": false,
  "allOf": [
    {
      "if": {
        "required": ["meta"],
        "properties": {
          "meta": {
            "type": "object",
            "required": ["diagramKind"],
            "properties": { "diagramKind": { "const": "sequence" } }
          }
        }
      },
      "then": {
        "type": "object",
        "required": ["participants", "messages"],
        "properties": {
          "participants": {},
          "messages": {},
          "nodes": { "not": {} },
          "edges": { "not": {} }
        }
      },
      "else": {
        "type": "object",
        "required": ["nodes"],
        "properties": {
          "nodes": {},
          "participants": { "not": {} },
          "messages": { "not": {} }
        }
      }
    }
  ],
  "properties": {
    "schemaVersion": {
      "type": "integer",
      "const": 1,
      "description": "Top-level only. Fixed to 1 for first version."
    },
    "meta": {
      "$ref": "#/$defs/meta"
    },
    "nodes": {
      "type": "array",
      "minItems": 1,
      "maxItems": 100,
      "description": "Flowchart only (diagramKind is flowchart or omitted). Hard cap 100; soft cap 60 (skill prompts user to narrow scope above soft cap).",
      "items": { "$ref": "#/$defs/node" }
    },
    "edges": {
      "type": "array",
      "description": "Flowchart only. Forbidden when meta.diagramKind is sequence.",
      "items": { "$ref": "#/$defs/edge" }
    },
    "participants": {
      "type": "array",
      "minItems": 1,
      "maxItems": 12,
      "description": "Sequence only. Declaration order is the lifeline order from left to right.",
      "items": { "$ref": "#/$defs/participant" }
    },
    "messages": {
      "type": "array",
      "minItems": 1,
      "description": "Sequence only. Array order (depth-first after frame expansion) is the message order. Soft cap 30, hard cap 60 counted over the recursively expanded declared messages.",
      "items": {
        "oneOf": [
          { "$ref": "#/$defs/message" },
          { "$ref": "#/$defs/frame" }
        ]
      }
    }
  },
  "$defs": {
    "claimState": {
      "type": "string",
      "enum": ["verified", "inferred", "unconfirmed"],
      "description": "Assertion-level state for a node/edge. verified requires ALL evidence.state=verified and >=1 inspected code or document location; inferred has mixed evidence or strong-but-unproven; unconfirmed has no verified evidence."
    },
    "evidenceState": {
      "type": "string",
      "enum": ["verified", "inferred", "unconfirmed"],
      "description": "Per-evidence state."
    },
    "meta": {
      "type": "object",
      "required": ["title", "question", "scope", "languageProfile", "summary"],
      "additionalProperties": false,
      "properties": {
        "title": { "type": "string", "minLength": 1 },
        "question": { "type": "string", "minLength": 1 },
        "scope": { "type": "string", "minLength": 1 },
        "languageProfile": { "type": "string", "minLength": 1 },
        "uiLocale": {
          "type": "string",
          "enum": ["en", "zh-CN"],
          "description": "Optional fixed renderer UI locale. Use the conversation/output locale; default to English when omitted."
        },
        "summary": { "type": "string", "minLength": 1, "description": "Panorama summary. Non-empty (v3.2.14: aligned with validator and design intent)." },
        "diagramKind": {
          "type": "string",
          "enum": ["flowchart", "sequence"],
          "description": "Optional diagram family. flowchart is the default and keeps nodes/edges; sequence requires participants/messages and forbids nodes/edges. layoutDirection/layoutBands only apply to flowchart."
        },
        "layoutDirection": {
          "type": "string",
          "enum": ["TD", "LR"],
          "description": "Optional macro flow direction. TD is the default; LR is for business flows whose main stages should progress left to right."
        },
        "layoutBands": {
          "type": "array",
          "minItems": 1,
          "description": "Optional semantic phase bands for a balanced multi-row business flow. Each node subgraph must appear in exactly one band. Bands use the outer TD direction; their own direction controls the left/right reading order.",
          "items": { "$ref": "#/$defs/layoutBand" }
        }
      }
    },
    "layoutBand": {
      "type": "object",
      "required": ["title", "direction", "subgraphs"],
      "additionalProperties": false,
      "properties": {
        "title": { "type": "string", "minLength": 1 },
        "direction": { "type": "string", "enum": ["LR", "RL"] },
        "subgraphs": {
          "type": "array",
          "minItems": 1,
          "items": { "type": "string", "minLength": 1 }
        }
      }
    },
    "node": {
      "type": "object",
      "required": ["id", "title", "claimState", "evidence", "detail"],
      "additionalProperties": false,
      "properties": {
        "id": {
          "type": "string",
          "pattern": "^[A-Za-z][A-Za-z0-9_-]*$",
          "description": "Stable id, usable as Mermaid node id, globally unique."
        },
        "title": { "type": "string", "minLength": 1 },
        "category": { "type": "string" },
        "subgraph": { "type": "string" },
        "claimState": { "$ref": "#/$defs/claimState" },
        "evidence": {
          "type": "array",
          "minItems": 1,
          "items": { "$ref": "#/$defs/evidence" }
        },
        "detail": { "$ref": "#/$defs/detail" }
      }
    },
    "edge": {
      "type": "object",
      "required": ["from", "to", "claimState", "evidence"],
      "additionalProperties": false,
      "properties": {
        "from": { "type": "string" },
        "to": { "type": "string" },
        "label": { "type": "string" },
        "labelKind": {
          "type": "string",
          "enum": ["action", "condition"],
          "description": "Optional relationship-label semantics. action is the default; condition renders as a condition badge rather than a directional action label."
        },
        "claimState": { "$ref": "#/$defs/claimState" },
        "evidence": {
          "type": "array",
          "minItems": 1,
          "items": { "$ref": "#/$defs/evidence" }
        }
      }
    },
    "participant": {
      "type": "object",
      "required": ["id", "title", "claimState", "evidence"],
      "additionalProperties": false,
      "properties": {
        "id": {
          "type": "string",
          "pattern": "^[A-Za-z][A-Za-z0-9_-]*$",
          "description": "Stable id shared by MapSpec, selection keys and detail views. The DSL generator deterministically maps it to an internal safe id (icm_pN); values that collide with sequence syntax keywords stay legal here."
        },
        "title": {
          "type": "string",
          "minLength": 1,
          "maxLength": 100,
          "pattern": "^[^\\n\\r]*$",
          "description": "Single-line display name shown next to the lifeline. Length counts Unicode code points (hard cap 100; soft cap handled by the skill workflow). Newlines are rejected because a newline after `as` would inject a new DSL statement."
        },
        "claimState": { "$ref": "#/$defs/claimState" },
        "evidence": {
          "type": "array",
          "minItems": 1,
          "items": { "$ref": "#/$defs/evidence" }
        },
        "detail": { "$ref": "#/$defs/detail" }
      }
    },
    "message": {
      "type": "object",
      "required": ["from", "to", "label", "claimState", "evidence"],
      "additionalProperties": false,
      "properties": {
        "from": { "type": "string", "minLength": 1, "description": "Declared participant id. Self-messages allow from == to." },
        "to": { "type": "string", "minLength": 1, "description": "Declared participant id." },
        "label": {
          "type": "string",
          "minLength": 1,
          "maxLength": 100,
          "pattern": "^[^\\n\\r]*$",
          "description": "Single-line message text. Length counts Unicode code points (soft cap 40, hard cap 100); content beyond the soft cap moves into detail. Newlines are rejected because multi-line messages split the mapped text block and break the record mapping."
        },
        "arrowKind": {
          "type": "string",
          "enum": ["solid", "dashed"],
          "description": "solid (default) is a call/initiation; dashed is a response/return."
        },
        "claimState": { "$ref": "#/$defs/claimState" },
        "evidence": {
          "type": "array",
          "minItems": 1,
          "items": { "$ref": "#/$defs/evidence" }
        },
        "detail": { "$ref": "#/$defs/detail" },
        "activation": {
          "type": "object",
          "additionalProperties": false,
          "properties": {
            "activatesTo": { "type": "boolean", "description": "Activate the `to` participant with this message (Mermaid `+`). Forbidden inside frames and when deactivatesFrom is also true." },
            "deactivatesFrom": { "type": "boolean", "description": "Deactivate the `from` participant with this message (Mermaid `-`). Forbidden inside frames and when activatesTo is also true." }
          },
          "description": "Optional inline activation change. Both booleans true is rejected; messages inside frames must not carry activation at all. Pairing is validated linearly over declaration order (outer activation may wrap whole frames)."
        }
      }
    },
    "frame": {
      "type": "object",
      "required": ["frame", "kind"],
      "additionalProperties": false,
      "properties": {
        "frame": { "type": "boolean", "const": true, "description": "Discriminator separating frames from messages in the mixed messages array." },
        "kind": { "type": "string", "enum": ["loop", "opt", "alt"] },
        "label": {
          "type": "string",
          "maxLength": 100,
          "pattern": "^[^&;#<>\"$:%\\n\\r]*$",
          "description": "Frame condition for loop/opt, rendered as plain text. The character contract rejects & ; # < > \" $ : % and newlines: entities get shredded by narrow-frame wrapping, $ triggers math rendering, : is consumed by wrap:/nowrap: control prefixes, % is deleted by Mermaid directive preprocessing, and newlines inject DSL statements. alt never reads this field: its branch conditions come from the respective branches[].label."
        },
        "messages": {
          "type": "array",
          "items": {
            "oneOf": [
              { "$ref": "#/$defs/message" },
              { "$ref": "#/$defs/frame" }
            ]
          }
        },
        "branches": {
          "type": "array",
          "minItems": 2,
          "description": "alt only: mutually exclusive branches rendered with else.",
          "items": { "$ref": "#/$defs/frameBranch" }
        }
      }
    },
    "frameBranch": {
      "type": "object",
      "required": ["label", "messages"],
      "additionalProperties": false,
      "properties": {
        "label": {
          "type": "string",
          "minLength": 1,
          "maxLength": 100,
          "pattern": "^[^&;#<>\"$:%\\n\\r]*$",
          "description": "Branch condition, subject to the same plain-text character contract as frame labels."
        },
        "messages": {
          "type": "array",
          "items": {
            "oneOf": [
              { "$ref": "#/$defs/message" },
              { "$ref": "#/$defs/frame" }
            ]
          }
        }
      }
    },
    "evidence": {
      "type": "object",
      "required": ["path", "state"],
      "additionalProperties": false,
      "allOf": [
        {
          "if": { "properties": { "state": { "const": "verified" } }, "required": ["state"] },
          "then": {
            "type": "object",
            "required": ["path", "lineStart", "lineEnd", "state"],
            "additionalProperties": false,
            "properties": {
              "path": { "type": "string", "minLength": 1, "pattern": "^(?!/)(?!\\\\)(?![A-Za-z]:[\\\\/]).+$" },
              "lineStart": { "type": "integer", "minimum": 1 },
              "lineEnd": { "type": "integer", "minimum": 1 },
              "symbol": { "type": "string" },
              "note": { "type": "string" },
              "state": { "$ref": "#/$defs/evidenceState" }
            },
            "description": "verified evidence must carry a concrete code or document location with an inspected line range."
          }
        }
      ],
      "properties": {
        "path": {
          "type": "string",
          "minLength": 1,
          "pattern": "^(?!/)(?!\\\\)(?![A-Za-z]:[\\\\/]).+$",
          "description": "Relative path only. Regex rejects: empty, absolute (/), drive letters (C:\\), UNC (\\\\). Segment-level rules (no '..' or '.' segments, no backslashes anywhere) and acceptance test vectors live in mapspec-v1.build-rules.json, enforced by build-html.mjs unit tests (not by JSON Schema).",
          "$comment": "Schema intentionally stays clean of custom keywords so ajv strict mode compiles it without 'unknown keyword' errors. Segment-level path rejection cannot be expressed in regex; see mapspec-v1.build-rules.json pathValidation.acceptanceTestVectors."
        },
        "lineStart": { "type": "integer", "minimum": 1 },
        "lineEnd": { "type": "integer", "minimum": 1 },
        "symbol": { "type": "string" },
        "note": { "type": "string" },
        "state": { "$ref": "#/$defs/evidenceState" }
      },
      "$comment": "lineEnd>=lineStart enforcement and path segment checks live in mapspec-v1.build-rules.json, enforced by build-html.mjs (not JSON Schema)."
    },
    "detail": {
      "type": "object",
      "required": ["summary", "segments"],
      "additionalProperties": false,
      "properties": {
        "summary": { "type": "string", "minLength": 1 },
        "segments": {
          "type": "array",
          "items": { "$ref": "#/$defs/segment" }
        }
      }
    },
    "segment": {
      "type": "object",
      "required": ["kind", "title", "headers", "rows"],
      "additionalProperties": false,
      "properties": {
        "kind": { "type": "string", "enum": ["value", "schema", "code"] },
        "title": { "type": "string", "minLength": 1 },
        "subtitle": { "type": "string" },
        "headers": {
          "type": "array",
          "items": { "type": "string" },
          "minItems": 1
        },
        "rows": {
          "type": "array",
          "items": {
            "type": "array",
            "items": { "type": "string" }
          }
        }
      },
      "allOf": [
        {
          "if": {
            "properties": { "kind": { "const": "code" } },
            "required": ["kind"]
          },
          "then": {
            "properties": {
              "rows": {
                "type": "array",
                "maxItems": 80,
                "items": {
                  "type": "array",
                  "items": { "type": "string", "maxLength": 500 }
                }
              }
            }
          }
        }
      ],
      "$comment": "Code excerpt caps: at most 80 rows and 500 characters per cell. The 12,000-character per-segment total is enforced by the zero-dependency runtime validator because JSON Schema cannot sum nested string lengths."
    }
  }
}
